English,Spanish,French,German,Italian;;;;
Do this trip .,,,,;Haz este viaje...;Faites ce voyage…;Machen Sie diesen Ausflug.,,,,;Fai questo viaggio .,,,,
Again no further contact was received .,,,,;De nuevo, no recibimos más contacto...;Encore une fois, aucun autre contact n'a été reçu…;Auch hier gab es keinen weiteren Kontakt.,,,,;Ancora una volta non abbiamo ricevuto ulteriori contatti .,,,,
Bus took us to Old Town after 25 min wait where we were supposed to have 1.5hrs .,,,,;El autobús nos llevó al casco antiguo después de 25 minutos de espera, cuando se suponía que tendríamos una hora y media...;Le bus nous a emmenés dans la vieille ville après 25 minutes d'attente, alors que nous étions censés avoir une heure et demie…;Der Bus brachte uns nach 25 Minuten Wartezeit in die Altstadt, wo wir eigentlich 1,5 Stunden Zeit hätten haben sollen.,,,,;L'autobus ci ha portato alla Città Vecchia dopo 25 minuti di attesa, mentre avremmo dovuto aspettare 1,5 ore .,,,,
Absolutely eat at the restaurant at the top and try to get a table right on the edge .,,,,;Sin duda, come en el restaurante de arriba e intenta conseguir una mesa justo en la orilla...;Mangez absolument au restaurant au sommet et essayez d'avoir une table juste au bord…;Essen Sie unbedingt im Restaurant oben und versuchen Sie, einen Tisch ganz am Rand zu bekommen.,,,,;Mangia assolutamente al ristorante in cima e cerca di ottenere un tavolo proprio sul bordo .,,,,
A fabulous view which should not be missed .,,,,;Una vista fabulosa que no te puedes perder...;Une vue fabuleuse à ne pas manquer…;Eine fantastische Aussicht, die man sich nicht entgehen lassen sollte.,,,,;Una vista favolosa da non perdere .,,,,
A great way to get your bearings of the area and learn a little more about the war .,,,,;Una forma estupenda de orientarte por la zona y aprender un poco más sobre la guerra...;Un excellent moyen de se repérer dans le quartier et d'en apprendre un peu plus sur la guerre…;Eine tolle Möglichkeit, sich in der Gegend zu orientieren und etwas mehr über den Krieg zu erfahren.,,,,;Un ottimo modo per orientarsi nella zona e saperne un po' di più sulla guerra .,,,,
At least it is very short which in this case was a blessing .,,,,;Al menos es muy corto, lo que en este caso fue una bendición...;Au moins, c'est très court, ce qui, dans ce cas, était une bénédiction…;Zumindest ist es sehr kurz, was in diesem Fall ein Segen war.,,,,;Almeno è molto breve, il che in questo caso è stata una benedizione .,,,,
"And do not stop there ; climb the steep stairs to the top of the fort and the views are even better , not least because the cables of the cable car are not in the way .,,,,";"Y no te quedes ahí; Sube las empinadas escaleras hasta la cima del fuerte y las vistas son aún mejores, sobre todo porque los cables del teleférico no estorban.";"Et ne vous arrêtez pas là ; Montez les escaliers raides jusqu'au sommet du fort et la vue est encore plus belle, notamment parce que les câbles du téléphérique ne gênent pas…";"Und hören Sie hier nicht auf; Steigen Sie die steilen Stufen zur Festungsspitze hinauf, und die Aussicht ist noch besser, nicht zuletzt, weil die Seilbahnkabel nicht im Weg sind.";"E non fermarti qui; sali le ripide scale fino alla cima del forte e la vista è ancora migliore, non da ultimo perché i cavi della funivia non sono d'intralcio.,,,,"
Absolutely beautiful .,,,,;Absolutamente hermoso.;Absolument magnifique…;Einfach wunderschön.;Assolutamente meraviglioso.,,,,
Extremely expensive taxi with poor service quality .,,,,;Taxi extremadamente caro con mala calidad de servicio.;Taxi extrêmement cher avec un service médiocre…;Extrem teures Taxi mit schlechtem Service.;Taxi estremamente costoso con scarsa qualità del servizio.,,,,
Fantasic Views and a good restaurant at the top , we went to the war museum and it was first class , a bit pricey for the cable car but it is what it is .,,,,;Vistas fantásticas y un buen restaurante en la cima. Fuimos al museo de la guerra y era de primera clase, un poco caro para el teleférico, pero es lo que es.;Vues fantastiques et bon restaurant au sommet. Nous sommes allés au musée de la guerre et c'était en première classe, un peu cher pour le téléphérique, mais c'est comme ça…;Fantastische Aussicht und ein gutes Restaurant oben. Wir waren im Kriegsmuseum und es war Erste Klasse, etwas teuer für die Seilbahn, aber es ist, was es ist.;Viste fantastiche e un buon ristorante in cima, siamo andati al museo della guerra ed era di prima classe, un po' caro per la funivia ma è quello che è.,,,,
Each car hold 30 passengers so queueing time is not too long .,,,,;Cada vagón tiene capacidad para 30 pasajeros, así que el tiempo de cola no es demasiado largo.;Chaque cabine peut accueillir 30 passagers, donc la file d'attente n'est pas trop longue…;Jede Kabine fasst 30 Passagiere, daher ist die Wartezeit nicht zu lang.;Ogni carrozza contiene 30 passeggeri quindi il tempo di attesa non è troppo lungo.,,,,
Beautiful view from the top !,,,,;¡Hermosa vista desde la cima!;Magnifique vue depuis le sommet !…;Wunderschöne Aussicht von oben!;Bella vista dalla cima!,,,,
And she has still not established a fair and flexible seating policy that does not unfairly penalize people for the minivan pickup order that they have no control over .,,,,;Y todavía no ha establecido una política de asientos justa y flexible que no penalice injustamente a las personas por el orden de recogida de la miniván, sobre el cual no tienen control.;Et elle n'a toujours pas établi de politique de sièges juste et flexible qui ne pénalise pas injustement les gens pour la prise en charge en minibus sur laquelle ils n'ont aucun contrôle…;Und sie hat immer noch keine faire und flexible Sitzplatzregelung eingeführt, die die Leute nicht unfair für die Reihenfolge der Abholung im Minivan bestraft, über die sie keine Kontrolle haben.;E non ha ancora stabilito una politica di posti a sedere equa e flessibile che non penalizzi ingiustamente le persone per l'ordine di ritiro del minivan su cui non hanno alcun controllo.,,,,
At over √•¬£20 per person ,  the cable ride is far too quick and does not give enough time to appreciate the views.,,,,;A más de √•¬£20 por persona, el viaje en teleférico es demasiado rápido y no da tiempo suficiente para apreciar las vistas.;À plus de 20 £ par personne, le trajet en téléphérique est beaucoup trop rapide et ne laisse pas assez de temps pour apprécier la vue…;Mit über 20 £ pro Person ist die Seilbahnfahrt viel zu schnell und lässt nicht genug Zeit, die Aussicht zu genießen.;A oltre √•¬£20 a persona, la corsa in funivia è troppo veloce e non dà abbastanza tempo per apprezzare la vista.,,,,
Enjoyed a cappuccino at a quaint cafe once I arrived at the top and explored the ImperialFortress .,,,,;Disfruté de un capuchino en Una cafetería pintoresca una vez que llegué a la cima y exploré la Fortaleza Imperial.;J'ai apprécié Un cappuccino dans un café pittoresque une fois arrivé au sommet et après avoir exploré la forteresse impériale.;Genießen Sie einen Cappuccino im Ein uriges Café, als ich oben ankam und die Kaiserliche Festung erkundete.;Una volta ho bevuto un cappuccino in un bar caratteristico Sono arrivato in cima e ho esplorato l'ImperialFortress .,,,,
After requesting cancellation of transfers within minutes of making them and specifically requesting cancellation without charges - they did not specify they would deduct money and instead replied we have cancelled your transfers as requested .,,,,;Tras solicitar la cancelación de los traslados a los pocos minutos de realizarlos, y específicamente solicitar la cancelación sin cargos, no especificaron si deducirían el importe, sino que respondieron que ya habían cancelado sus traslados según lo solicitado.;Après avoir demandé l'annulation des transferts quelques minutes après les avoir effectués et expressément demandé une annulation sans frais, ils n'ont pas précisé qu'ils déduiraient de l'argent et ont répondu que nous avions annulé vos transferts comme demandé.;Nachdem ich innerhalb weniger Minuten die Stornierung der Transfers beantragt und ausdrücklich um eine kostenlose Stornierung gebeten hatte, wurde mir nicht ausdrücklich gesagt, dass Geld abgezogen würde, sondern stattdessen geantwortet: „Wir haben Ihre Transfers wie gewünscht storniert.“;Dopo aver richiesto l'annullamento dei trasferimenti entro pochi minuti dall'effettuarli e aver richiesto specificamente l'annullamento senza spese, non hanno specificato che avrebbero detratto denaro e invece hanno risposto che abbiamo annullato i tuoi trasferimenti come richiesto .,,,,
Even the other people in the same tour show more care than the guide , asking me do I need some cash to take the bus .,,,,;Incluso las otras personas del mismo tour mostraron más atención que el guía, preguntándome si necesitaba dinero para tomar el autobús.;Même les autres participants au même circuit se sont montrés plus attentionnés que le guide, me demandant si j'avais besoin d'argent liquide pour prendre le bus.;Sogar die anderen Teilnehmer derselben Tour zeigten mehr Aufmerksamkeit als der Reiseleiter und fragten mich, ob ich Bargeld für den Bus brauche.;Anche le altre persone nello stesso tour mostrano più attenzione della guida, chiedendomi se ho bisogno di contanti per prendere l'autobus .,,,,
Because of our constant complaining pne of them left until the end of the taxi line to bring one .,,,,;Debido a nuestras constantes quejas, algunos se quedaron hasta el final de la fila de taxis para traer uno.;À cause de nos plaintes constantes, certains d'entre eux sont restés jusqu'au bout de la file de taxis pour en amener un.;Wegen unserer ständigen Beschwerden wartete einer von ihnen bis zum Ende der Taxischlange, um ein Taxi zu holen.;A causa delle nostre continue lamentele, alcuni di loro sono andati fino alla fine della fila dei taxi per portarne uno .,,,,
Everything is three times the price as in the town as your a captive audience .,,,,;Todo cuesta el triple en el pueblo, ya que hay un público cautivo.;Tout est trois fois plus cher qu'en ville, car vous êtes un public captif.;Alles ist dreimal so teuer wie in der Stadt, da man ein gefangenes Publikum ist.;Tutto costa tre volte di più rispetto alla città, dato che sei un pubblico prigioniero .,,,,
Beautiful views for miles along the coast and the mountains - lovely restaurant views also .,,,,;Hermosas vistas a kilómetros de la costa y las montañas, y también con preciosas vistas desde el restaurante.;Vues magnifiques sur des kilomètres le long de la côte et des montagnes, avec de superbes vues sur les restaurants.;Wunderschöne Aussicht über Meilen hinweg entlang der Küste und der Berge – auch schöne Aussicht vom Restaurant.;Bellissime viste per chilometri lungo la costa e le montagne, anche le splendide viste del ristorante .,,,,
Excellent value for money with a visit to the Fort to see the Homeland War museum a must .,,,,;Excelente relación calidad-precio, con una visita obligada al Fuerte para ver el Museo de la Guerra Nacional.;Excellent rapport qualité-prix, avec une visite du Fort et du musée de la Guerre de Patrie incontournable.;Ausgezeichnetes Preis-Leistungs-Verhältnis. Ein Besuch des Forts und des Heimatkriegsmuseums ist ein Muss.;Ottimo rapporto qualità-prezzo con una visita al Forte per vedere il museo della Guerra della Patria, un must .,,,,
Do not book this Company .,,,,;No reserven con esta empresa.;Ne réservez pas avec cette compagnie.;Buchen Sie dieses Unternehmen nicht.;Non prenotare questa compagnia .,,,,
Do not book with this company .,,,,;No reserven con esta empresa.;Ne réservez pas avec cette compagnie.;Buchen Sie nicht bei diesem Unternehmen.;Non prenotare con questa compagnia .,,,,
Best avoided .,,,,;Mejor evitarlo. .,,,,;À éviter absolument. .,,,,;Am besten meiden Sie es. .,,,,;Meglio evitare .,,,,
Did not even explain that there are dangerous steps .,,,,;Ni siquiera me explicaron que había escalones peligrosos.,,,,;Il n'a même pas expliqué qu'il y avait des marches dangereuses.,,,,;Er hat nicht einmal erklärt, dass es gefährliche Stufen gibt.,,,,;Non spiega persino che ci sono gradini pericolosi.,,,,
Anyway 45 mins later with an extremely anxious wife the taxi turned up .,,,,;En fin, 45 minutos después, con mi esposa extremadamente nerviosa, llegó el taxi.,,,,;Bref, 45 minutes plus tard, avec une femme extrêmement inquiète, le taxi est arrivé.,,,,;Wie auch immer, 45 Minuten später kam das Taxi mit meiner extrem besorgten Frau.,,,,;Comunque 45 minuti dopo con una moglie estremamente ansiosa è arrivato il taxi.,,,,
A great way to orient yourself .,,,,;Una excelente manera de orientarse.,,,,;Une excellente façon de s'orienter.,,,,;Eine tolle Möglichkeit, sich zu orientieren.,,,,;Un ottimo modo per orientarsi.,,,,
40 minutes into our journey we pointed out we were definitely going the wrong way - he had NO idea how to get to the airport and then had no idea we had a flight to catch .,,,,;A los 40 minutos de viaje, le dijimos que definitivamente íbamos en dirección equivocada: él no tenía ni idea de cómo llegar al aeropuerto y luego ni siquiera sabía que teníamos que tomar un vuelo.,,,,;"Après 40 minutes de trajet, nous lui avons fait remarquer que nous allions clairement dans la mauvaise direction ; il ne savait absolument pas comment se rendre à l'aéroport et ignorait complètement que nous avions un vol à prendre.,,,,";Nach 40 Minuten Fahrt machten wir ihn darauf aufmerksam, dass wir definitiv in die falsche Richtung fuhren – er hatte KEINE Ahnung, wie wir zum Flughafen kommen, und dann auch keine Ahnung, dass wir einen Flug erwischen mussten.,,,,;A 40 minuti dal nostro viaggio abbiamo sottolineato che stavamo decisamente andando nella direzione sbagliata - non aveva idea di come arrivare all'aeroporto e poi non aveva idea che dovevamo prendere un volo.,,,,
Cant mind price , maybe 10euro or so , worth every penny .,,,,;No me importa el precio, quizá unos 10 euros, vale cada céntimo.,,,,;Le prix m'inquiète, peut-être une dizaine d'euros, ça vaut vraiment le coup.,,,,;Der Preis ist unschlagbar, vielleicht 10 Euro oder so, jeden Cent wert.,,,,;Non importa il prezzo, forse 10 euro o giù di lì, vale ogni centesimo.,,,,
False information !,,,,;¡Información falsa!,,,,;Fausses informations !,,,,;Falsche Informationen!,,,,;Informazioni false!,,,,
Although always busy the queue shortens quickly .,,,,;Aunque siempre está lleno, la cola se acorta rápidamente.,,,,;Même si la file d'attente est toujours bondée, elle se raccourcit rapidement.,,,,;Obwohl immer viel los ist, verkürzt sich die Warteschlange schnell.,,,,;Sebbene sempre affollata la coda si accorcia rapidamente.,,,,
"Being still on the cruise at 30 min of arriving to the port , we decided to contact VIDOKRUG ( tel +385 98 9363 767 ) because apparently it had "" good "" reviews .,,,,";Como todavía estábamos en el crucero a los 30 minutos de llegar al puerto, decidimos contactar con VIDOKRUG (tel. +385 98 9363 767) porque al parecer tenía buenas críticas.,,,,;Étant toujours sur le bateau 30 minutes après notre arrivée au port, nous avons décidé de contacter VIDOKRUG (tél. : +385 98 9363 767), car il avait apparemment de « bons » avis.,,,,;Da wir 30 Minuten nach unserer Ankunft im Hafen noch auf dem Kreuzfahrtschiff waren, beschlossen wir, VIDOKRUG (Tel. +385 98 9363 767) zu kontaktieren, da es anscheinend gute Bewertungen hatte.,,,,;"Essendo ancora in crociera a 30 minuti dall'arrivo al porto, abbiamo deciso di contattare VIDOKRUG (tel +385 98 9363 767) perché apparentemente aveva ""buone"" recensioni.,,,,"
Can not think of a better way to spend an evening or a location for al fresco dining !,,,,;No se me ocurre una mejor manera de pasar una noche ni un sitio para cenar al aire libre. !,,,,;Je ne vois pas de meilleure façon de passer une soirée ni de meilleur endroit pour dîner en plein air. !,,,,;Ich kann mir keine bessere Art vorstellen, einen Abend zu verbringen oder einen Ort für ein Essen im Freien. !,,,,;Non riesco a pensare a un modo migliore per trascorrere una serata o un posto per cenare all'aperto!,,,,
By waiting until the rush had gone , we got a great view and no hassle .,,,,;Al esperar a que se acabara la hora punta, disfrutamos de unas vistas estupendas sin complicaciones.,,,,;En attendant que l'affluence soit passée, nous avons eu une vue magnifique sans problème.,,,,;Indem wir warteten, bis der Ansturm vorbei war, hatten wir eine tolle Aussicht und das ganz ohne Stress.,,,,;Aspettando che la ressa fosse passata , abbiamo avuto una vista fantastica e senza problemi .,,,,
Amazing views and worth every penny .,,,,;Vistas increíbles que valen cada céntimo.,,,,;Vues incroyables et vaut vraiment le coup.,,,,;Wunderbare Aussicht und jeden Cent wert.,,,,;Viste incredibili e vale ogni centesimo .,,,,
Expensive , but worth it for the views ( especially the sunset if you time your trip correctly ) .,,,,;Caro, pero merece la pena por las vistas (sobre todo el atardecer si calculas bien el tiempo del viaje).,,,,;Cher, mais ça vaut le coup pour la vue (surtout le coucher de soleil si vous planifiez bien votre voyage).,,,,;Teuer, aber die Aussicht lohnt sich (besonders der Sonnenuntergang, wenn man die Fahrt richtig plant).,,,,;Costoso, ma ne vale la pena per la vista (specialmente il tramonto se si programma correttamente il viaggio) .,,,,
First three telephone calls failed .,,,,;Las tres primeras llamadas telefónicas fallaron.,,,,;Les trois premiers appels téléphoniques ont échoué.,,,,;Die ersten drei Telefongespräche schlugen fehl.,,,,;Le prime tre telefonate sono fallite .,,,,
DO NOT USE THIS COMPANY .,,,,;NO UTILICEN ESTA COMPAÑÍA.,,,,;NE PAS UTILISER CETTE ENTREPRISE.,,,,;BENUTZEN SIE DIESES UNTERNEHMEN NICHT.,,,,;NON USARE QUESTA COMPAGNIA .,,,,
Excellent views of the city and surrounding islands .,,,,;Excelentes vistas de la ciudad y las islas de los alrededores.,,,,;Excellentes vues sur la ville et les îles environnantes.,,,,;Hervorragende Aussicht auf die Stadt und die umliegenden Inseln.,,,,;Viste eccellenti della città e delle isole circostanti .,,,,
"Be sure to climb to the top of the fortress , where you will get a 360 degree view of the area ; the interior stairs look questionable , but they are fine .,,,,";"No olviden subir a lo alto de la fortaleza, donde tendrán una vista de 360 __grados de la zona. Las escaleras interiores parecen cuestionables, pero están bien. No se lo pierdan, sobre todo si disfrutan del buen tiempo. Cuesta 85 kunas por persona; no vale la pena subir, ya que es caro. En lo alto del teleférico se encuentra el fuerte, que actualmente alberga una fantástica exposición sobre la guerra de 1990/1991. No olviden llevar la cámara y no se pierdan el teleférico, que creo que sube y baja cada 10 minutos. (Solo necesitamos 3 taxis para 9 personas). Se negaron a aceptar que se tratara de un fallo de su sistema de reservas y simplemente lo atribuyeron. Aunque tienen ascensor, no sube al nivel superior de observación. No se pierdan el Museo de la Guerra en el Monte Srd. Pero la cima de la colina no me parece nada especial. .,,,,";"N'oubliez pas de monter au sommet de la forteresse, d'où vous aurez une vue à 360 degrés sur la région ; Les escaliers intérieurs semblent douteux, mais ils sont bien.";Steigen Sie unbedingt auf die Festungsspitze, von wo aus Sie einen 360-Grad-Blick auf die Umgebung haben. Die Innentreppe sieht fragwürdig aus, ist aber in Ordnung.;"Assicurati di salire in cima alla fortezza, dove avrai una vista a 360 gradi della zona; le scale interne sembrano discutibili, ma sono belle.,,,,"
Do not miss it , all the more so if you are enjoying good weather .,,,,;¡Sin duda las mejores vistas de la costa adriática y probablemente el mejor bistec!,,,,;À ne pas manquer, surtout si vous profitez du beau temps.;Nicht verpassen, vor allem bei schönem Wetter.;Non perdertele, a maggior ragione se vi godete il bel tempo.,,,,
cost 85 kuna per pax , not worth the journey up as it is expensive .,,,,;;Le prix est de 85 kunas par personne, mais le trajet ne vaut pas la peine, car il est cher.;Kosten 85 Kuna pro Person, der Aufstieg lohnt sich nicht, da er teuer ist.;costa 85 kune a persona, non vale la pena di salire perché è costoso.,,,,
At the top of the cable car is the fort which is currently hosting a fantastic exhibition of the war in 1990/1991 .,,,,;;Au sommet du téléphérique se trouve le fort, qui accueille actuellement une superbe exposition sur la guerre de 1990-1991.;Oben an der Seilbahn befindet sich die Festung, in der derzeit eine fantastische Ausstellung über den Krieg 1990/1991 gezeigt wird.;In cima alla funivia c'è il forte che attualmente ospita una fantastica mostra sulla guerra del 1990/1991.,,,,
Definitely bring your camera and do not miss taking the cable car , which I believe goes up and down every 10 minutes .,,,,;;N'oubliez pas votre appareil photo et ne manquez pas le téléphérique, qui, je crois, monte et descend toutes les 10 minutes.;Bringen Sie unbedingt Ihre Kamera mit und fahren Sie unbedingt mit der Seilbahn, die, glaube ich, alle 10 Minuten auf und ab fährt.;Portate sicuramente la macchina fotografica e non perdetevi la funivia, che credo salga e scenda ogni 10 minuti.,,,,
( we only needed 3 taxis for 9 of us ) They refused to accept that this was a fault with their booking system and simply blamed the fact.,,,,;;(Nous n'avons eu besoin que de 3 taxis pour 9 personnes). Ils ont refusé d'admettre qu'il s'agissait d'un problème avec leur système de réservation et ont simplement attribué ce problème à ce fait.;(Wir brauchten nur drei Taxis für neun Personen.) Sie wollten nicht akzeptieren, dass dies ein Fehler im Buchungssystem war, und haben einfach darauf verwiesen.;(abbiamo avuto bisogno solo di 3 taxi per 9 di noi) Si sono rifiutati di accettare che questo fosse un difetto del loro sistema di prenotazione e hanno semplicemente dato la colpa al fatto.,,,,
Although they have an elevator , it does not go to the upper observation level .,,,,;;Bien qu'ils disposent d'un ascenseur, il ne dessert pas le niveau d'observation supérieur.;Obwohl es einen Aufzug gibt, fährt dieser nicht bis zur oberen Aussichtsplattform.;Sebbene abbiano un ascensore, non va al livello di osservazione superiore.,,,,
Do not miss the War Museum on MountSrd .,,,,;;Ne manquez pas le musée de la guerre sur le mont Srd.;Verpassen Sie nicht das Kriegsmuseum auf dem Berg Srd.;Non perdetevi il Museo della Guerra sul Monte Srd.,,,,
But I do not find the top of the hill anything special .,,,,;;Mais je ne trouve pas le sommet de la colline exceptionnel. .,,,,;Aber ich finde die Spitze des Hügels nichts Besonderes. .,,,,;Ma non trovo la cima della collina niente di speciale .,,,,
Definitely the best views along the Adriatic coast and probably the best steak !,,,,;;Sans aucun doute les plus belles vues de la côte adriatique et probablement le meilleur steak !,,,,;Definitiv die beste Aussicht entlang der Adriaküste und wahrscheinlich das beste Steak!,,,,;Sicuramente la vista migliore lungo la costa adriatica e probabilmente la bistecca migliore!,,,,